,District,BuildingName,ReportedDate/LastDateofVisitbyAnyoftheInvolvedCase(s),RelatedConfirmed/ProbableCase(s)
1033,Sha Tin,"Kwai Shing House, May Shing Court",7955,
1034,Sham Shui Po,"Fu Wen House, Fu Cheong Estate",7956,
1035,Sham Shui Po,Ka To Building,7957,
1036,Wong Tai Sin,"Block 4, Tsui Chuk Garden",7958,
1037,Kwai Tsing,"Shek Wing House, Shek Lei (II) Estate",7959,
1038,Central & Western,"Block D, Phase II, Kwan Yick Building",7960,
1039,Sha Tin,"Yan Hei House, Yan On Estate",7961,
1040,Kwun Tong,"Kam Shek House, Ping Shek Estate",7962,
1041,Wong Tai Sin,"Sau Man House, Choi Wan (I) Estate",7963,
1042,Sha Tin,"Block 1, Ravana Garden",7964,
1043,Central & Western,24 Possession Street,7965,
1044,Wan Chai,Southhorn Garden,7966,
1045,Central & Western,"Block B, Carolina Gardens",7967,
1046,Eastern,"Hiu Fung House, Fung Wah Estate",7968,
1047,Eastern,"Hiu Fung House, Fung Wah Estate",7969,
1048,Eastern,"Hiu Fung House, Fung Wah Estate",7970,
1049,Sha Tin,"Ming Yan Lau, Jat Min Chuen",7971,
1050,Tuen Mun,"Tin Yue House, Tin King Estate",7972,
1051,Wan Chai,"Block B, Hay Wah Building",7973,
1052,Kowloon City,"Kwun Wing House, Kwun Tak Court",7974,
1053,Yau Tsim Mong,Harbour Plaza Metropolis,7978,
1054,Kwai Tsing,"Shing Keung House, Kwai Shing East Estate",7979,
1055,Kowloon City,"Mei Po House, Mei Tung Estate",7980,
1056,Sham Shui Po,Golden Court,7981,
1057,Central & Western,Windsor Court,7982,
1058,Sham Shui Po,"Tao Tak House, Lei Cheng Uk Estate",7983,
1059,Sham Shui Po,"Tao Tak House, Lei Cheng Uk Estate",7984,
1060,Kwun Tong,"Ping Shing House, Ping Tin Estate",7985,
1061,Kwai Tsing,"Leung Fat House, Cheung Fat Estate",7986,
1062,Tai Po,"Tower 7, Solaria",7987,
1063,Tuen Mun,"Block 2, Phase 1, Tai Hing Gardens",7988,
1064,Sham Shui Po,"Fu Sing House, Fu Cheong Estate",7989,
1065,Kowloon City,24A Ming Lun Street,7990,
1066,North,Tai Po Tin Tsuen,7991,
1067,Central & Western,The Elgin,7992,
1068,Kwun Tong,"On Kin House, On Tin Estate",7993,
1069,Kwai Tsing,"Shing Keung House, Kwai Shing East Estate",7994,
1070,Central & Western,Lascar Court,7995,
1071,Kowloon City,"Ching Man House, Ho Man Tin Estate",7996,
1072,Kwai Tsing,"Shing Keung House, Kwai Shing East Estate",7997,
1073,Central & Western,"Tower 2, Kwong Fung Terrace",7998,
1074,North,Kan Tau Tsuen,7999,
1075,Central & Western,165 Queen's Road West,8000,
1076,Eastern,King Tsui Court,8001,
1077,Eastern,"Sui Lung House, Siu Sai Wan Estate",8002,
1078,Sha Tin,"Imperial Heights, Belair Gardens",8003,
1079,Sha Tin,"Kam Ling House, Kam Fung Court",8004,
1080,Kowloon City,"Ming Garden, 283 Prince Edward Road West",8005,
1081,Kwai Tsing,"Block 8, Kwai Shing West Estate",8006,
1082,Sham Shui Po,"Un Wai House, Un Chau Estate",8007,
1083,Kowloon City,Metro6,8008,
1084,Southern,"Wah Tai House, Wah Fu (II) Estate",8009,
1085,Kwun Tong,"Block 4, Lotus Tower, Kwun Tong Garden Estate",8010,
1086,Sha Tin,"Yan Hei House, Yan On Estate",8012,
1087,Tuen Mun,"Wan Hei House, Siu Hei Court",8013,
1088,Kwun Tong,"Kwai Leung House,Lower Ngau Tau Kok Estate",8014,
1089,Kwai Tsing,"Kwai Tai House, Kwai Fong Estate",8015,
1090,Yau Tsim Mong,"Cheong Ling Mansion, 3-13 Nullah Road",8017,
1091,Sham Shui Po,"Tao Tak House, Lei Cheng Uk Estate",8018,
1092,Kwun Tong,"Block 2, Sau Mau Ping Disciplined Services Quarters",8019,
1093,Kwun Tong,"Shuk Mei House, Yau Mei Court",8020,
1094,Tai Po,Tseng Tau Village,8021,
1095,Central & Western,Wo On Building,8022,
1096,Eastern,"Bik Tsui House, Hiu Tsui Court",8023,
1097,Sham Shui Po,"Tower 1, Manhattan Hill",8024,
1098,Eastern,King Tsui Court,8025,
1099,Sai Kung,Tseng Lan Shue,8026,
1100,Kwun Tong,"Yuk Mei House, Yau Chui Court",8027,
1101,Kwun Tong,"Choi Tin House, Hing Tin Estate",8028,
1102,Tsuen Wan,"Shek Tsui House, Shek Wai Kok Estate",8029,
1103,Sha Tin,"Block 6, Grandeur Garden",8030,
1104,Sha Tin,"Block 6, Grandeur Garden",8031,
1105,Tsuen Wan,"Tower 2, Primrose Hill",8032,
1106,Kwai Tsing,"Lai Choi House, Lai Yan Court",8033,
1107,Eastern,Kwong Yick Building,8034,
1108,Sha Tin,"Kam Kei House, Kam Tai Court",8035,
1109,Yau Tsim Mong,"Block 7, Charming Garden",8036,
1110,Yau Tsim Mong,"Block 7, Charming Garden",8037,
1111,Kwai Tsing,"Chun Tai House, Ching Tai Court",8038,
1112,Sai Kung,"Sheung Yan House, Sheung Tak Estate",8039,
1113,Sha Tin,"Block 3, Ravana Garden",8040,
1114,Wong Tai Sin,26 Lung Chi Path,8041,
1115,Wong Tai Sin,"Pak Suet House, Choi Hung Estate",8042,
1116,Tai Po,"Heng Tai House, Fu Heng Estate",8043,
1117,Kowloon City,"Lok Seen Lau, Lok Man Sun Chuen",8044,
1118,Kowloon City,Iclub Ma Tau Wai Hotel,8044,
1119,Sha Tin,"High Block, Sun Yuet House, Sun Chui Estate",8045,
1120,Sha Tin,"High Block, Sun Yuet House, Sun Chui Estate",8046,
1121,Kwai Tsing,"Shek Yan House, Shek Lei (II) Estate",8047,
1122,Tuen Mun,"Block A, Greenland Garden",8048,
1123,Tuen Mun,"Block A, Greenland Garden",8049,
1124,Kwun Tong,"Hon Pak House, Wan Hon Estate",8050,
1125,Yau Tsim Mong,42 Tung Choi Street,8051,
1126,Yau Tsim Mong,"Man Fai Building, 26-48 Man Ying Street",8052,
1127,Tai Po,Nam Hang,8053,
1128,Wong Tai Sin,"Ming Lai House, Choi Wan (II) Estate",8054,
1129,Sha Tin,"High Block, Sun Yuet House",8055,
1130,Kwun Tong,"Ching Tat House, On Tat Estate",8056,
1131,Kwun Tong,"Yat Lai House, Yau Lai Estate",8057,
1132,Tai Po,"Sun Wo House, Tai Wo Estate",8058,
1133,Sha Tin,Horizon Suite Hotel,8059,
1134,Sha Tin,"Yu Lam Court, Lucky Plaza",8060,
1135,Sha Tin,"Ming Shun Lau, Jat Min Chuen",8061,
1136,Kwun Tong,"Ying Lok House, Choi Ying Estate",8062,
1137,Wong Tai Sin,"Wah Yuen House, Chuk Yuen South Estate",8063,
1138,Tai Po,6 Wai Yan Street,8064,
1139,Yuen Long,"Chung Ho House, Tin Chung Court",8065,
1140,Wan Chai,The Charterhouse,8066,
1141,Wan Chai,The Charterhouse,8067,
1142,Wan Chai,Rosedale Hotel Hong Kong,8068,
1143,Sham Shui Po,"Tung Hoi House, Tai Hang Tung Estate",8069,
1144,Sham Shui Po,"Un Tai House, Un Chau Estate",8070,
1145,North,"Tower 3, Wing Fai Centre",8071,
1146,Sha Tin,"Block 3, Ravana Garden",8072,
1147,Yuen Long,"Tower 5, GRAND YOHO",8073,
1148,Yuen Long,"Tower 7, Uptown",8074,
1149,Kwun Tong,"Ping Shing House, Ping Tin Estate",8075,
1150,Kwun Tong,"Ping Sin House, Ping Tin Estate",8076,
1151,Yau Tsim Mong,Holiday Inn Golden Mile,8077,
1152,Wong Tai Sin,"Choi Yip House, Choi Fai Estate",8078,
1153,Tsuen Wan,"Hoi Ngan Mansion, Riviera Gardens",8079,
1154,Kowloon City,24A Ming Lun Street,8081,
1155,Kowloon City,"Ming Garden, 283 Prince Edward Road West",8082,
1156,Eastern,"Block A, Ming Wah Dai Ha",8083,
1157,Sai Kung,"Block 3, On Ning Garden",8084,
1158,Sham Shui Po,"Un Mun House, Un Chau Estate",8085,
1159,Eastern,"Hing Hon Building, King's Road",8087,
1160,Tuen Mun,"Tower 2, Aegean Coast, So Kwun Wat",8088,
1161,Sha Tin,"Yan Hei House, Yan On Estate",8089,
1162,Sha Tin,"Yan Hei House, Yan On Estate",8090,
1163,Tsuen Wan,"Shek Tsui House, Shek Wai Kok Estate",8091,
1164,Eastern,"Tsui Pik House, Shan Tsui Court",8092,
1165,North,"Tung Kok Wai, Lung Yeuk Tau",8093,
1166,Tsuen Wan,"Tak Tai Building, Tai Ha Street",8094,
1167,Sham Shui Po,"Lim Kit House, Lei Cheng Uk Estate",8095,
1168,Yuen Long,"Chung Ho House, Tin Chung Court",8096,
1169,Sha Tin,"Tower 3, Park Belvedere",8097,
1170,Central & Western,165 Queen's Road West,8098,
1171,Kwun Tong,"Block 2, Lotus Tower, Kwun Tong Garden Estate",8099,
1172,Yau Tsim Mong,"Greenery Court, Fa Yuen Street",8100,
1173,Yau Tsim Mong,42 Tung Choi Street,8101,
1174,Wong Tai Sin,"Choi Yip House, Choi Fai Estate",8103,
1175,Kwun Tong,"Yat Lai House, Yau Lai Estate",8104,
1176,Kowloon City,Kiu Yu Mansion,8105,
1177,Kwun Tong,"Block 2, Lotus Tower, Kwun Tong Garden Estate",8106,
1178,Yuen Long,"Lok Sing Building, Kau Yuk Road",8107,
1179,North,"Block 3, Wing Fai Centre",8108,
1180,Kwun Tong,"Tsui Tsz House, Tsui Ping (North) Estate",8109,
1181,Kowloon City,"Ming Garden, 283 Prince Edward Road West",8110,
1182,North,"Tung Kok Wai, Lung Yeuk Tau",8111,
1183,Sha Tin,"Hi Shek House, Shek Mun Estate",8112,
1184,Tsuen Wan,"Shek Tsui House, Shek Wai Kok Estate",8113,
1185,Kwai Tsing,"Ting Fung House, Ning Fung Court",8114,
1186,Islands,"Seahorse Lane, Discovery Bay",8115,
1187,Kowloon City,26 Pang Ching Street,8116,
1188,Sham Shui Po,"Gladiolus House, So Uk Estate",8117,
1189,Tai Po,"Shin Lun House, Fu Shin Estate",8118,
1190,Kwun Tong,"Block B, Wang Kwong Building",8119,
1191,Wong Tai Sin,"Hung Shek House, Ping Shek Estate",8120,
1192,Kwun Tong,"Yat Lai House, Yau Lai Estate",8121,
1193,Kwun Tong,"Yat Lai House, Yau Lai Estate",8123,
1194,Kwun Tong,"Yat Lai House, Yau Lai Estate",8124,
1195,Eastern,"Block 19, Heng Fa Chuen",8126,
1196,Sai Kung,"Block 4, Hong Sing Garden",8127,
1197,Wong Tai Sin,1 Fu Chi Path,8128,
1198,Wong Tai Sin,1 Fu Chi Path,8129,
1199,Sai Kung,"Block 4, Hong Sing Garden",8130,
1200,Yau Tsim Mong,"Peony House East Block, Pok Man Street",8132,
1201,Tai Po,"Peony House East Block, Pok Man Street",8133,
1202,Yau Tsim Mong,"Peony House East Block, Pok Man Street",8134,
1203,Sha Tin,"Kam Ho House, Kam Fung Court",8135,
1204,Yuen Long,"Block 2, Grandeur Terrace",8136,
1205,Tsuen Wan,"Unicorn Heights, Hong Kong Garden",8137,
1206,Southern,"Tung Yat House, Lei Tung Estate",8138,
1207,Wong Tai Sin,"Ching Yuk House, Tsz Ching Estate",8139,
1208,Yau Tsim Mong,Kensington Plaza,8140,
1209,Yau Tsim Mong,B P International,8140,
1210,Kowloon City,"Tower 6, Mantin Heights",8141,
1211,Islands,Tong Fuk Tsuen,8142,
1212,Wan Chai,"Block 2, Ronsdale Garden",8143,
1213,Southern,L'hotel Island South,8144,
1214,Central & Western,408D Des Voeux Road West,8144,
1215,Yau Tsim Mong,Novotel Hong Kong Nathan Road Kowloon,8145,
1216,Kowloon City,Metropark Hotel Kowloon,8146,
1217,Sha Tin,"San Shek House, Shek Mun Estate",8147,
1218,Eastern,"Block 2, Cheerful Garden",8148,
1219,Kwun Tong,Haven of Hope Sau Mau Ping Day Activity Centre cum Hostel,8149,
1220,Kwun Tong,"Lam Tai House, Lam Tin Estate",8150,
1221,Kwun Tong,"Hong King House, Hong Yat Court",8151,
1222,Kowloon City,"Lai Ming Court,  Cheung Ning Street",8152,
1223,Tsuen Wan,"Tak Tai Building, Tai Ha Street",8153,
1224,Sham Shui Po,Pei Ho Street Municipal Services Building and Cooked Food Centre,"5436, 5816",22/11/2020
1225,Yau Tsim Mong,Golden Era Plaza é‡‘å„·æ˜Ÿ,"5568, 5606, 5607, 5609, 5615, 5665, 5670, 5671, 5675, 5676, 5682, 5683, 5689, 5703, 5708, 5711, 5725, 5734, 5737, 5738, 5740, 5743, 5745, 5750, 5751, 5752, 5754, 5762, 5764, 5767, 5769, 5772, 5773, 5774, 5775, 5776, 5782, 5783, 5811, 5818, 5822, 5825, 5840, 5841, 5842, 5843, 5845, 5850, 5856, 5857, 5858, 5863, 5879, 5883, 5884, 5891, 5907, 5918, 5919, 5922, 5924, 5925, 5928, 5932, 5933, 5934, 5943, 5963, 5964, 6023, 6095, 6106, 6111, 6112, 6113, 6183, 6184, 6223, 6224, 6232, 6238, 6256, 6257, 6297, 6371, 6488, 6544, 6650, 6651, 6655, 6843, 7002",22/11/2020
1226,Sha Tin,Belair Gardens Commercial Complex Hsin Kuang Banquet Hall,"5599, 5615, 5642, 5674, 5742, 5751, 5766, 5813, 5900, 5906, 5915, 6042, 6048, 6049, 6175",22/11/2020
1227,Tai Po,Tai Po Rural Committee Po Heung Street,"5648, 5756",22/11/2020
1228,Kwun Tong,Kai Yip Commercial Centre Double Happiness Restaurant (æ˜Ÿè¼å®´æœƒå»³),"5669, 5688, 5689, 5703, 5762, 5774, 5808, 5853, 5990, 6026, 6070, 6085, 6120, 6333, 6377, 6462, 7279",22/11/2020
1229,Yau Tsim Mong,Grand Plaza Gyu-Kaku Buffet,"5882, 6003",22/11/2020
1230,Yau Tsim Mong,Kowloon Funeral Parlour,"6036, 6064",22/11/2020
1231,Wan Chai,68 Yee Wo Street,"5511, 6016",23/11/2020
1232,Wan Chai,Great Smart Tower Dance Concept,"5515, 5547, 5748, 5921, 5984, 6360",23/11/2020
1233,Sham Shui Po,Park Fook Industrial Building Matex Club,"5532, 5590, 5859",23/11/2020
1234,Southern,Abba Commerical Building,"5625, 5641, 5723, 5973",23/11/2020
1235,Tai Po,88 Square Saizeriya Restaurant,"5648, 5756",23/11/2020
1236,Yuen Long,Ching Tai Street æµ·ç£æµ·é®® é…’å®¶,"5917, 6108",23/11/2020
1237,Yau Tsim Mong,Lai Ming Building,"6031, 6149, 6158, 6180",23/11/2020
1238,Yau Tsim Mong,Mary Building Starway Music Studio,"5578, 5647, 5680, 5681, 5721, 5796, 5797, 5805, 5806, 5935, 5982, 6575",24/11/2020
1239,Wan Chai,Lee Garden Two Phillip Wain,"5935, 5947, 5955, 6162, 6233, 6234, 6773",24/11/2020
1240,Eastern,City Plaza 4,"5955, 6016, 6030",24/11/2020
1241,Sham Shui Po,Dragon Centre Genki Sushi,"6002, 6039",24/11/2020
1242,Kowloon City,To Kwa Wan Market,"5663, 5925",25/11/2020
1243,Sai Kung,Monterey Place,"5754, 5793, 5887",25/11/2020
1244,Sha Tin,Hin Keng Shopping Centre Happiness Cuisine,"5901, 5925",25/11/2020
1245,Yau Tsim Mong,Miramar Shopping Centre Phillip Wain,"5889, 5930, 5947, 5955, 6030, 6032, 6033, 6080, 6081, 6083, 6087, 6162, 6185, 6200, 6219, 6220, 6222, 6227, 6228, 6234, 6252, 6296, 6773",26/11/2020
1246,Central &Western,Alliance Building Chuen Cheung Kui,"6055, 6136, 6171, 6247, 6350",26/11/2020
1247,Sham Shui Po,Nob Hill Square Betterment Banquet Hall,"5579, 5689, 5766, 5810, 5852, 5859, 5884, 5923, 5940, 5965, 6002, 6009, 6105, 6138, 6221, 6226, 6306, 6308, 6449, 6494",27/11/2020
1248,Wan Chai,Hong Kong Sanatorium & Hospital,"5587, 5714, 5801, 6198, 6199, 6382, 6726",27/11/2020
1249,Eastern,Sai Wan Ho Municipal Services Building,"5783, 6494",27/11/2020
1250,Central &Western,Alexandra House Otto e Mezzo 81â„2  Bombana,"6072, 6160, 6172, 6176, 6177, 6182",27/11/2020
1251,Central &Western,Shun Tak Centre China Merchants Tower,"6247, 6259",27/11/2020
1252,Kwun Tong,Kwun Tong Industrial Centre Phase 2,"6302, 6305",27/11/2020
1253,Sham Shui Po,Tin On Industrial Building,"6013, 6178, 6690",28/11/2020
1254,Central &,Lippo Centre Tower 1,"6216, 6313, 6317,",28/11/2020
1255,Western,,"6411, 6715",
1256,Central &Western,Loon Kee Building Sky Cuisine (Sheung Wan),"6251, 6279, 6487, 6550, 6630, 6634, 6635, 6742, 6763, 6791",28/11/2020
1257,Yau Tsim Mong,Harbour Plaza Metropolis Senzuru Japanese Restaurant,"6539, 6540",28/11/2020
1258,Central &Western,IFC Sen-ryo,"6674, 6784",28/11/2020
1259,Sai Kung,Metro Town,"5824, 6547",29/11/2020
1260,Yau Tsim Mong,The One,"6035, 6051, 6430",29/11/2020
1261,Wan Chai,SOGO Hong Kong,"6051, 6067, 6650",29/11/2020
1262,Central &Western,420 Queen's Road West Blue Mountain Restaurant,"6246, 6602",29/11/2020
1263,Yau Tsim Mong,Hong Kong Coliseum,"6539, 6541, 6542, 6667, 6956, 7234, 7352",29/11/2020
1264,Central &Western,International Finance Centre Lei Garden Restaurant,"6539, 6540",29/11/2020
1265,Wan Chai,Hopewell Centre The Grand Buffet,"6597, 6717",29/11/2020
1266,Yau Tsim Mong,Grand Plaza Tao Heung The Pier Market Store,"5858, 6838",30/11/2020
1267,Yau Tsim Mong,Tung Wah Group of Hospitals Ho Yuk Ching Willow Lodge,"6275, 6370, 6774, 6795, 6812",30/11/2020
1268,Kowloon City,Tung Wah Group of Hospitals Wong Fut Nam College,"6376, 6396",30/11/2020
1269,Eastern,Customs Headquarters Building,"5685, 6735",01/12/2020
1270,Wan Chai,Times Square Club Albergue,"6207, 6958",01/12/2020
1271,Kwun Tong,Telford Plaza I,"6313, 6866",01/12/2020
1272,Sai Kung,"Construction site at Phase 9, LOHAS Park","6345, 6346, 6387, 6416, 6451, 6453, 6454, 6455, 6456, 6481, 6482, 6483, 6484, 6485, 6486, 6489, 6491, 6503, 6507, 6509, 6510, 6555, 6598, 6617, 6628, 6629, 6638, 6797, 6823, 6844, 6868, 6879, 6915, 6935, 7040, 7141, 7373",01/12/2020
1273,Kwun Tong,Yen Sheng Centre Super Star Chinese Cuisine,"6509, 6510",01/12/2020
1274,Yau Tsim Mong,Hang Seng Mong Kok Building,"6540, 6672",01/12/2020
1275,North,Choi Yuen Plaza Cable Car Restaurant,"6550, 6650",01/12/2020
1276,Eastern,Hong Kong Chinese Women's Club College,"6633, 7063",01/12/2020
1277,Wan Chai,Immigration Tower,"7242, 7414",01/12/2020
1278,Wong Tai Sin,Yue Xiu Plaza Hsin Kuang Banquet Hall,"5532, 5547, 5561, 5568, 5574, 5576, 5592, 5612, 5634, 5672, 5674, 5688, 5739, 5747, 5766, 5771, 5781, 5790, 5800, 5832, 5864, 5870, 5961, 6314, 6433, 6553, 6635, 6995, 7065, 7235",02/12/2020
1279,Yau Tsim Mong,Tern Plaza TamJai SamGor,"6081, 6757",02/12/2020
1280,Yau Tsim Mong,Wu Sang House Superior,"6556, 6731",02/12/2020
1281,Yau Tsim Mong,121 Sai Yee Street Lei Garden,"6740, 6746",02/12/2020
1282,Sha Tin,Lucky Plaza,"5813, 6016, 6892, 6934",03/12/2020
1283,Yau Tsim Mong,Good Hope Building London Restaurant,"5892, 6838",03/12/2020
1284,Kwun Tong,Sau Mau Ping Shopping Centre,"6156, 6296, 6955, 7118, 7204",03/12/2020
1285,Kwun Tong,Laguna Plaza,"6570, 6821",03/12/2020
1286,Kowloon City,Construction site at Inland Revenue Tower in Kai Tak Development,"6628, 6638, 6879",03/12/2020
1287,Wan Chai,Lee Gardens Three Duckee,"6665, 6746, 6752, 6860, 6910, 6937, 6976, 7110",03/12/2020
1288,Wan Chai,Hysan Place,"5426, 5895, 7096",04/12/2020
1289,Kwun Tong,APM,"5556, 6067, 6914, 7307",04/12/2020
1290,Sha Tin,Lung Hang Market,"5909, 6778, 6779, 7286",04/12/2020
1291,Tsuen Wan,Yeung Uk Road Municipal Services Building,"6509, 6860, 7006",04/12/2020
1292,Kwun Tong,Prosperity Place,"6786, 6904",04/12/2020
1293,Central &Western,Golden Sun Centre,"6792, 6881, 6962",04/12/2020
1294,Kowloon City,354 Prince Edward Road West Mrs Hunan,"7142, 7143",04/12/2020
1295,Sha Tin,Tai Wai Market,"5730, 5883, 6892",05/12/2020
1296,Kwai Tsing,Kwai Chung Plaza Bubble Tea Work,"6003, 7011",05/12/2020
1297,Eastern,TWGHs Fong Shu Chuen,"6179, 6351, 6608,",05/12/2020
1298,Sham Shui Po,Pei Ho Street Municipal Services Building,"6341, 6885, 7364",05/12/2020
1299,Kowloon City,Ching Long Shopping Centre,"6374, 6959, 6992",05/12/2020
1300,Sha Tin,Sha Tin Government Offices,"6779, 6962",05/12/2020
1301,Kowloon City,Centre for Health Protection,"6927, 7028, 7056, 7117",05/12/2020
1302,Sham Shui Po,Festival Walk,"5534, 5895, 7575",06/12/2020
1303,Sha Tin,New Town Plaza,"5575, 5780, 7186",06/12/2020
1304,Sha Tin,"YATA Department Store (Shatin), L1 & 2, New Town Plaza 3","6067, 6621, 6818, 6848, 6993, 7033, 7051, 7090, 7184, 7267, 7268, 7269, 7270, 7291, 7343, 7352, 7357, 7374, 7613, 7632, 7715, 7961",06/12/2020
1305,Sha Tin,Hin Keng Shopping Centre,"6199, 7094",06/12/2020
1306,Islands,D'Deck Pascucci,"6492, 7306",06/12/2020
1307,Kwai Tsing,Kwai Chung Shopping Centre,"6672, 6860, 7208",06/12/2020
1308,Tai Po,Hong Kong Police Force New Territories North Regional Headquarters,"6675, 6951",06/12/2020
1309,Kwun Tong,COS Centre Long Feng Hao,"6827, 7478",06/12/2020
1310,Sha Tin,Mei Lam Shopping Centre,"6892, 7049",06/12/2020
1311,Sai Kung,Po Pak House Po Ming Court,6930,06/12/2020
1312,Tai Po,The Golden Gate Shopping Mall Man Fong CafÃ©,6951,06/12/2020
1313,Yau Tsim Mong,G/F 202 Sai Yeung Choi Street South,6957,06/12/2020
1314,Sha Tin,Lucky Plaza Tak Hing Restaurant,"6960, 7199",06/12/2020
1315,Tuen Mun,Eldo Court Shopping Centre,6989,06/12/2020
1316,Tuen Mun,H.A.N.D.S,6989,06/12/2020
1317,Sha Tin,Grand Central Plaza,6993,06/12/2020
1318,Islands,Yat Tung Shopping Centre,7009,06/12/2020
1319,Kwai Tsing,MTR Kwai Fong Station,7011,06/12/2020
1320,Eastern,Wah Hoi Mansion Fu Wah CafÃ©,7032,06/12/2020
1321,Tsuen Wan,Panda Place Ushi Shabu,7035,06/12/2020
1322,Sham Shui Po,80 Fuk Wing Street Eat Together,7051,06/12/2020
1323,Sham Shui Po,Precious Blood Hospital,7051,06/12/2020
1324,Sai Kung,"Ming Chau House, Kin Ming Estate",7056,06/12/2020
1325,Wong Tai Sin,26 Yan Oi Street Po Yuen Cafe,7069,06/12/2020
1326,Southern,Wah Fu (I) Shopping Centre,7072,06/12/2020
1327,Sha Tin,Hin Keng Shopping Centre Good Take Cart Noodles,7094,06/12/2020
1328,Wan Chai,555 Hennessy Road,7096,06/12/2020
1329,Sha Tin,Lakeside 1 Nam Sky Kitchen,7096,06/12/2020
1330,Yuen Long,YOHO I Green Waffle Diner,"7096, 7390",06/12/2020
1331,Sha Tin,Kings Wing Plaza 1 ShaTin Buddies Restaurant,7101,06/12/2020
1332,Sha Tin,Sha Kok Commercial Centre,7101,06/12/2020
1333,Sha Tin,Tin Po Building Daniel's Restaurant,7108,06/12/2020
1334,Kwun Tong,"G/F, Wai King Building",7112,06/12/2020
1335,Islands,Airport Police Station,7126,06/12/2020
1336,Kwun Tong,"2/F, Yuk Shek House Ping",7139,06/12/2020
1337,Sham Shui Po,Po On Road Municipal Services Building,7139.0,06/12/2020
1338,Kowloon City,Fashion World The Whampoa,7141.0,06/12/2020
1339,Kowloon City,G/F 99-109 Dock Street,7141.0,06/12/2020
1340,Tai Po,Kwong Fuk Commercial Centre Star Seafood Restaurant,7155.0,06/12/2020
1341,Wan Chai,Lee Garden Two 10 Shanghai,7173.0,06/12/2020
1342,Wan Chai,Wanchai Commercial Centre,7173.0,06/12/2020
1343,Sha Tin,New Town Plaza Phase 3 Chun Shui Tang,7186.0,06/12/2020
1344,Sha Tin,New Town Plaza Phase 3 Hazukido,7186.0,06/12/2020
1345,Eastern,Yue Wan Estate å¾·è²æµ·é®® é…’å®¶,7187.0,06/12/2020
1346,Sha Tin,New Jade Shopping Arcade Salala,7200.0,06/12/2020
1347,Tsuen Wan,KOLOUR â€§ Tsuen Wan Peninsula Cuisine,7208.0,06/12/2020
1348,Tsuen Wan,Tai Hung Fai (Tsuen Wan) Centre Choi Fook Royal Banquet (Closed),7208.0,06/12/2020
1349,Kwai Tsing,Kwai Fong Plaza,7232.0,06/12/2020
1350,Sha Tin,Lucky Plaza Genki Sushi,7270,06/12/2020
1351,Sham Shui Po,Un On Building Yunnan Style,7270,06/12/2020
1352,Kwai Tsing,Shek Yam Shopping Centre,7281,06/12/2020
1353,Tai Po,G/F 60-62 Kwong Fuk Road,7289,06/12/2020
1354,Tai Po,Treasure Garden Oi-Shi- Sushi,"7289, 7290",06/12/2020
1355,Kwun Tong,Benson Tower,7314,06/12/2020
1356,Sham Shui Po,315 Lai Chi Kok Road Q1,7315,06/12/2020
1357,Tai Po,Tower 1 Deerhill Tower,7323,06/12/2020
1358,Sha Tin,Alva Hotel by Royal,7343,06/12/2020
1359,Sham Shui Po,Lei Cheng Uk Shopping Centre Pier 88,7357,06/12/2020
1360,Sham Shui Po,98 Yee Kuk Street å¤©ç¥¥é£¯ åº—,7358,06/12/2020
1361,Yau Tsim Mong,Chinachem Golden Plaza,7360,06/12/2020
1362,Yau Tsim Mong,New Mandarin Plaza Fairwood,7360,06/12/2020
1363,Yau Tsim Mong,Star House,7360,06/12/2020
1364,Yau Tsim Mong,The Lamma Tower Floom Floom,7360,06/12/2020
1365,Yuen Long,Ho Shun Tai Building Tai Hing,7361,06/12/2020
1366,Sham Shui Po,21 Glee Path Mimikai CafÃ©,7368,06/12/2020
1367,Yau Tsim Mong,K11 Musea,7388,06/12/2020
1368,Yau Tsim Mong,Mira Place 1,7388,06/12/2020
1369,Sha Tin,"G/F, Lakeside 1, 8 Science Park West Avenue Nam Sky Kitchen",7391,06/12/2020
1370,Sham Shui Po,G/F Sunlight Building,7397,06/12/2020
1371,Sham Shui Po,Un Chau Shopping Centre Sushi Express,7421,06/12/2020
1372,Kwun Tong,Lei Yue Mun Municipal Services Building,7440,06/12/2020
1373,Kwun Tong,Lei Yue Mun Plaza Ngan Lung Restaurant,7440,06/12/2020
1374,Tai Po,Plover Cove Garden Shopping Centre,7478,06/12/2020
1375,Tai Po,Plover Cove Garden Shopping Centre Victoria Harbour Restaurant,7478,06/12/2020
1376,Kwai Tsing,Kwai Chung Centre,7481,06/12/2020
1377,Sai Kung,Sheung Tak Plaza 101 Taiwanese Restaurant,7486,06/12/2020
1378,Sha Tin,Ma On Shan Plaza Fairwood,7523,06/12/2020
1379,Yau Tsim Mong,Olympian City 2 Kentucky Fried Chicken,7536,06/12/2020
1380,Yau Tsim Mong,Olympian City KFC,7536,06/12/2020
1381,Tsuen Wan,Cheong Kwai Court Wealthy Garden,7655,06/12/2020
1382,Sai Kung,Tseung Kwan O Government Complex,7786,06/12/2020
1383,Southern,Ocean Park,"5741, 6163, 7141",07/12/2020
1384,Yau Tsim Mong,Langham Place,"5964, 6003, 6928, 7360",07/12/2020
1385,Kwun Tong,Sau Yat House Sau Mau Ping Estate,6955,07/12/2020
1386,Yau Tsim Mong,26 Wan Fung Street è¥¿è¨˜ç²¥ åº—,6975,07/12/2020
1387,Kowloon City,Hong Kong Baptist Hospital,6975,07/12/2020
1388,Kwun Tong,Sau Mau Ping Shopping Centre CafÃ© de Coral,6994,07/12/2020
1389,Tuen Mun,Butterfly Market,7010,07/12/2020
1390,Tuen Mun,Siu Hei Court Commercial Centre é‡‘éŠ˜æ½®å·žç²‰éºµ,7010,07/12/2020
1391,North,Oi Man Plaza CafÃ© 100%,7013,07/12/2020
1392,Tuen Mun,The Hong Kong Society for the Blind Jockey Club Tuen Mun Home for the Aged Blind,7014,07/12/2020
1393,Kwai Tsing,Kwai Shing East Shopping Centre,"7058, 7178",07/12/2020
1394,Kwai Tsing,Kwai Shing West Shopping Centre,7058,07/12/2020
1395,Kwai Tsing,Kwai Chung Plaza Fu Wah CafÃ©,7059,07/12/2020
1396,Tsuen Wan,65 Tai Ho Road,7060,07/12/2020
1397,Wong Tai Sin,Yue Xiu Plaza Cheung Ying Seafood Restaurant,7064,07/12/2020
1398,Yau Tsim Mong,Block A Wah May Building,7084,07/12/2020
1399,Yau Tsim Mong,Cordis Hotels & Resorts Hong Kong,7084,07/12/2020
1400,Wan Chai,Harcourt House,7101,07/12/2020
1401,Wong Tai Sin,Kam Pik House Maple CafÃ©,7113,07/12/2020
1402,Sham Shui Po,Kowloon Technical School,7115,07/12/2020
1403,Yau Tsim Mong,Fa Yuen Street Market,7135,07/12/2020
1404,Kwun Tong,MTR Kowloon Bay Station,7140,07/12/2020
1405,Kwai Tsing,Kwai Chung Plaza CafÃ© de Coral,7149,07/12/2020
1406,Kwai Tsing,Wing Fong Street Market,7149,07/12/2020
1407,Tai Po,Tai Po Mega Mall Jade Garden,7155,07/12/2020
1408,Southern,Marina Square West Centre Shanghai Lao Lao,7173,07/12/2020
1409,Sha Tin,Sui Wo Court Shopping Centre,"7175, 7236",07/12/2020
1410,Tsuen Wan,New Territories South Regional Police Headquarters,7183,07/12/2020
1411,Yau Tsim Mong,59A Public Square Street Hei Yin Restaurant,7187,07/12/2020
1412,Kowloon City,Harbour Place,7188,07/12/2020
1413,Eastern,406 - 408 King's Road Ocean Empire Food Shop,7211,07/12/2020
1414,Tuen Mun,Emerald Bay,7227,07/12/2020
1415,Wan Chai,C.C.Wu Building,7232,07/12/2020
1416,Central &Western,G/F 122 Belcher's Street,7276,07/12/2020
1417,Wong Tai Sin,Tak Oi Secondary School,7278,07/12/2020
1418,Kwai Tsing,North Kwai Chung Market,7281,07/12/2020
1419,Tsuen Wan,Belvedere Garden Tai Hing,7287,07/12/2020
1420,Tsuen Wan,Tai Hung Fai (Tsuen Wan) Centre Magic Touch,7289,07/12/2020
1421,Tsuen Wan,Ocean Pride Mall Joyous Gate,7291,07/12/2020
1422,Eastern,Hing Wah Centre å½©é€¸æ¼æ¸¯,7310,07/12/2020
1423,Eastern,Yue Wan Market,7310,07/12/2020
1424,Yau Tsim Mong,16 Granville Road,7315,07/12/2020
1425,Yau Tsim Mong,Lung Mong Building å”è¨˜ åŒ…é»ž,7317,07/12/2020
1426,Central &Western,Entertainment Building,7340,07/12/2020
1427,Kowloon City,25 Sung Kit Street æ–§å§ BBQ BAR & Restaurant,7359,07/12/2020
1428,Yau Tsim Mong,T.O.P This Is Our Place,7360,07/12/2020
1429,Yuen Long,Cheong Fat Building é‡‘é¦™ æ³°èœ,7361,07/12/2020
1430,Sham Shui Po,Fung Sing Building,7363,07/12/2020
1431,Sham Shui Po,Lai Kok Estate Lai Kuk House,7363,07/12/2020
1432,Sham Shui Po,"Lai Lan House, Lai Kok Estate",7363,07/12/2020
1433,Sha Tin,Biotech Centre 2,7427,07/12/2020
